{
  "type": "object",
  "properties": {
    "schema_version": {
      "const": "2.0",
      "type": "string"
    },
    "artifacts": {
      "type": "object",
      "additionalProperties": {
        "type": "string",
        "minLength": 1
      }
    },
    "model_name": {
      "type": "string",
      "minLength": 1
    },
    "model_version": {
      "type": "string",
      "minLength": 1
    },
    "meta": {
      "$ref": "#/$defs/ResultMeta"
    }
  },
  "required": [
    "schema_version",
    "artifacts",
    "model_name",
    "model_version",
    "meta"
  ],
  "additionalProperties": false,
  "$schema": "https://json-schema.org/draft/2020-12/schema",
  "$id": "https://remote-image.local/schemas/v2/damage-result.schema.json",
  "title": "DamageResult",
  "$defs": {
    "ResultMeta": {
      "type": "object",
      "properties": {
        "schema_version": {
          "enum": [
            "2.0"
          ],
          "type": "string"
        },
        "event_id": {
          "type": "string",
          "minLength": 1
        },
        "study_area_id": {
          "type": "string",
          "minLength": 1
        },
        "input_asset_ids": {
          "type": "array",
          "items": {
            "type": "string",
            "minLength": 1
          }
        },
        "method": {
          "type": "string",
          "minLength": 1
        },
        "method_version": {
          "type": "string",
          "minLength": 1
        },
        "parameters": {
          "type": "object",
          "additionalProperties": {}
        },
        "created_at": {
          "type": "string",
          "format": "date-time"
        },
        "warnings": {
          "type": "array",
          "items": {
            "type": "string",
            "minLength": 1
          }
        }
      },
      "required": [
        "schema_version",
        "event_id",
        "study_area_id",
        "input_asset_ids",
        "method",
        "method_version",
        "parameters",
        "created_at",
        "warnings"
      ],
      "additionalProperties": false
    }
  }
}
